{
  "$schema": "https://json-schema.org/draft/2020-12/schema",
  "$id": "https://raw.githubusercontent.com/august-villagegames/winnow/v0.2.0/.agents/skills/winnow/references/seed.schema.json",
  "title": "Portable Winnow v4 session seed",
  "type": "object",
  "additionalProperties": false,
  "required": ["protocol", "schemaVersion", "runtimeVersion", "session", "profileExclusions", "profilePatterns", "history", "round"],
  "properties": {
    "protocol": {"const": "winnow.portable-session"},
    "schemaVersion": {"const": 4},
    "runtimeVersion": {"const": "4.0.0"},
    "session": {"$ref": "#/$defs/session"},
    "profileExclusions": {"$ref": "#/$defs/profileExclusions"},
    "profilePatterns": {"$ref": "#/$defs/profilePatterns"},
    "history": {"type": "array", "items": {"$ref": "#/$defs/completedRound"}},
    "round": {"$ref": "#/$defs/round"}
  },
  "$defs": {
    "id": {"type": "string", "pattern": "^[A-Za-z0-9][A-Za-z0-9_-]{0,127}$"},
    "plain": {"type": "string", "minLength": 1},
    "profileExclusions": {"type": "array", "uniqueItems": true, "items": {"type": "string", "minLength": 1, "maxLength": 500}},
    "profilePattern": {
      "type": "object",
      "additionalProperties": false,
      "required": ["key", "factorId", "polarity", "direction", "value", "mean", "supportCount", "strength"],
      "properties": {
        "key": {"type": "string", "minLength": 1, "maxLength": 500, "pattern": "^\\{\\\"direction\\\":\\\"(?:include|exclude|lower|higher|average)\\\",\\\"factorId\\\":\\\"[A-Za-z0-9][A-Za-z0-9_-]{0,127}\\\",\\\"polarity\\\":\\\"(?:like|dislike)\\\",\\\"value\\\":(?:null|true|false|\\\"(?:[^\\\"\\\\]|\\\\.)*\\\")\\}$"},
        "factorId": {"$ref": "#/$defs/id"},
        "polarity": {"enum": ["like", "dislike"]},
        "direction": {"enum": ["include", "exclude", "lower", "higher", "average"]},
        "value": {"type": ["string", "boolean", "null"]},
        "mean": {"type": ["number", "null"]},
        "supportCount": {"type": "integer", "minimum": 2},
        "strength": {"type": "number", "minimum": 0, "maximum": 1}
      },
      "oneOf": [
        {"properties": {"direction": {"const": "include"}, "value": {"type": ["string", "boolean"]}, "mean": {"const": null}}},
        {"properties": {"direction": {"const": "exclude"}, "value": {"type": "boolean"}, "mean": {"const": null}}},
        {"properties": {"direction": {"enum": ["lower", "higher"]}, "value": {"const": null}, "mean": {"const": null}}},
        {"properties": {"direction": {"const": "average"}, "value": {"const": null}, "mean": {"type": "number"}}}
      ]
    },
    "profilePatterns": {
      "type": "array",
      "maxItems": 6,
      "uniqueItems": true,
      "x-winnow-uniqueItemsBy": "key",
      "$comment": "The standard JSON Schema uniqueItems keyword compares complete records. The Winnow validator must additionally enforce uniqueness of profilePattern.key and cross-record exclusion conflicts.",
      "items": {"$ref": "#/$defs/profilePattern"}
    },
    "timestamp": {"type": "string", "format": "date-time"},
    "session": {
      "type": "object",
      "additionalProperties": false,
      "required": ["id", "title", "query", "requirements", "imagePolicy"],
      "properties": {
        "id": {"$ref": "#/$defs/id"},
        "title": {"type": "string", "minLength": 1, "maxLength": 120},
        "query": {"type": "string", "minLength": 1, "maxLength": 1000},
        "requirements": {"type": "array", "minItems": 0, "maxItems": 5, "uniqueItems": true, "items": {"type": "string", "minLength": 1, "maxLength": 100}},
        "primaryFactorId": {"$ref": "#/$defs/id"},
        "imagePolicy": {"$ref": "#/$defs/imagePolicy"}
      }
    },
    "imagePolicy": {
      "oneOf": [
        {"type": "object", "additionalProperties": false, "required": ["mode"], "properties": {"mode": {"const": "required"}}},
        {"type": "object", "additionalProperties": false, "required": ["mode", "reason"], "properties": {"mode": {"const": "notApplicable"}, "reason": {"type": "string", "minLength": 1, "maxLength": 300}}}
      ]
    },
    "source": {
      "type": "object",
      "additionalProperties": false,
      "required": ["id", "title", "url", "retrievedAt"],
      "properties": {
        "id": {"$ref": "#/$defs/id"},
        "title": {"type": "string", "minLength": 1, "maxLength": 200},
        "url": {"type": "string", "format": "uri", "pattern": "^https://"},
        "retrievedAt": {"$ref": "#/$defs/timestamp"}
      }
    },
    "numberDisplay": {
      "oneOf": [
        {"type": "object", "additionalProperties": false, "required": ["style"], "properties": {"style": {"const": "decimal"}}},
        {"type": "object", "additionalProperties": false, "required": ["style", "unit"], "properties": {"style": {"const": "decimal"}, "unit": {"const": "nominations"}}},
        {"type": "object", "additionalProperties": false, "required": ["style", "currency"], "properties": {"style": {"const": "currency"}, "currency": {"const": "USD"}}},
        {"type": "object", "additionalProperties": false, "required": ["style"], "properties": {"style": {"const": "percent"}}},
        {"type": "object", "additionalProperties": false, "required": ["style", "unit"], "properties": {"style": {"const": "duration"}, "unit": {"enum": ["minute", "hour", "day", "week", "month", "year"]}}}
      ]
    },
    "booleanDisplay": {
      "type": "object",
      "additionalProperties": false,
      "required": ["style", "trueLabel", "falseLabel"],
      "properties": {"style": {"const": "boolean"}, "trueLabel": {"type": "string", "minLength": 1, "maxLength": 100}, "falseLabel": {"type": "string", "minLength": 1, "maxLength": 100}}
    },
    "textDisplay": {
      "type": "object",
      "additionalProperties": false,
      "required": ["style"],
      "properties": {"style": {"const": "text"}}
    },
    "factor": {
      "type": "object",
      "additionalProperties": false,
      "required": ["id", "label", "valueType", "display"],
      "properties": {
        "id": {"$ref": "#/$defs/id"},
        "label": {"type": "string", "minLength": 1, "maxLength": 120},
        "valueType": {"enum": ["number", "boolean", "category", "text"]},
        "display": {"oneOf": [{"$ref": "#/$defs/numberDisplay"}, {"$ref": "#/$defs/booleanDisplay"}, {"$ref": "#/$defs/textDisplay"}]}
      }
    },
    "description": {
      "type": "object",
      "additionalProperties": false,
      "required": ["text", "sourceId"],
      "properties": {"text": {"type": "string", "minLength": 1, "maxLength": 800}, "sourceId": {"$ref": "#/$defs/id"}}
    },
    "image": {
      "type": "object",
      "additionalProperties": false,
      "required": ["url", "alt", "sourceId"],
      "properties": {"url": {"type": "string", "format": "uri", "pattern": "^https://"}, "alt": {"type": "string", "minLength": 1, "maxLength": 200}, "sourceId": {"$ref": "#/$defs/id"}}
    },
    "optionUrl": {
      "type": "object",
      "additionalProperties": false,
      "required": ["url", "sourceId"],
      "properties": {"url": {"type": "string", "format": "uri", "pattern": "^https://"}, "sourceId": {"$ref": "#/$defs/id"}}
    },
    "value": {
      "type": "object",
      "additionalProperties": false,
      "required": ["factorId", "value", "sourceId"],
      "properties": {
        "factorId": {"$ref": "#/$defs/id"},
        "value": {"oneOf": [{"type": "number"}, {"type": "boolean"}, {"type": "string", "minLength": 1}]},
        "sourceId": {"$ref": "#/$defs/id"}
      }
    },
    "option": {
      "type": "object",
      "additionalProperties": false,
      "required": ["id", "title", "primarySourceId", "values"],
      "properties": {
        "id": {"$ref": "#/$defs/id"},
        "title": {"type": "string", "minLength": 1, "maxLength": 200},
        "primarySourceId": {"$ref": "#/$defs/id"},
        "description": {"$ref": "#/$defs/description"},
        "image": {"$ref": "#/$defs/image"},
        "images": {"type": "array", "minItems": 1, "maxItems": 5, "items": {"$ref": "#/$defs/image"}},
        "optionUrl": {"$ref": "#/$defs/optionUrl"},
        "values": {"type": "array", "minItems": 1, "items": {"$ref": "#/$defs/value"}}
      }
    },
    "verdict": {
      "type": "object",
      "additionalProperties": false,
      "required": ["optionId", "decision"],
      "properties": {"optionId": {"$ref": "#/$defs/id"}, "decision": {"enum": ["like", "dislike", "skip"]}}
    },
    "round": {
      "type": "object",
      "additionalProperties": false,
      "required": ["number", "generatedAt", "factors", "sources", "options"],
      "properties": {
        "number": {"type": "integer", "minimum": 1},
        "generatedAt": {"$ref": "#/$defs/timestamp"},
        "factors": {"type": "array", "minItems": 1, "maxItems": 6, "items": {"$ref": "#/$defs/factor"}},
        "sources": {"type": "array", "minItems": 1, "items": {"$ref": "#/$defs/source"}},
        "options": {"type": "array", "minItems": 4, "maxItems": 10, "items": {"$ref": "#/$defs/option"}}
      }
    },
    "completedRound": {
      "type": "object",
      "additionalProperties": false,
      "required": ["number", "generatedAt", "factors", "sources", "options", "verdicts"],
      "properties": {
        "number": {"type": "integer", "minimum": 1},
        "generatedAt": {"$ref": "#/$defs/timestamp"},
        "factors": {"type": "array", "minItems": 1, "maxItems": 6, "items": {"$ref": "#/$defs/factor"}},
        "sources": {"type": "array", "minItems": 1, "items": {"$ref": "#/$defs/source"}},
        "options": {"type": "array", "minItems": 4, "maxItems": 10, "items": {"$ref": "#/$defs/option"}},
        "verdicts": {"type": "array", "minItems": 4, "maxItems": 10, "items": {"$ref": "#/$defs/verdict"}}
      }
    },
    "continuationParent": {
      "type": "object",
      "additionalProperties": false,
      "required": ["sessionId", "roundNumber", "seedHash", "url"],
      "properties": {"sessionId": {"$ref": "#/$defs/id"}, "roundNumber": {"type": "integer", "minimum": 1}, "seedHash": {"type": "string", "pattern": "^[0-9a-f]{64}$"}, "url": {"type": "string", "format": "uri", "pattern": "^https://"}}
    },
    "continuation": {
      "type": "object",
      "additionalProperties": false,
      "required": ["protocol", "schemaVersion", "parent", "session", "parentProfilePatterns", "parentProfileExclusions", "profilePatterns", "profileExclusions", "completedRounds", "nextRoundNumber"],
      "properties": {
        "protocol": {"const": "winnow.continuation"},
        "schemaVersion": {"const": 4},
        "parent": {"$ref": "#/$defs/continuationParent"},
        "session": {"$ref": "#/$defs/session"},
        "parentProfilePatterns": {"$ref": "#/$defs/profilePatterns"},
        "parentProfileExclusions": {"$ref": "#/$defs/profileExclusions"},
        "profilePatterns": {"$ref": "#/$defs/profilePatterns"},
        "profileExclusions": {"$ref": "#/$defs/profileExclusions"},
        "completedRounds": {"type": "array", "minItems": 1, "items": {"$ref": "#/$defs/completedRound"}},
        "nextRoundNumber": {"type": "integer", "minimum": 2}
      }
    }
  }
}
